{
  "Material": "example_value",
  "RequestedQuantity": "example_value",
  "RequestedQuantityUnit": "example_value",
  "Plant": "example_value",
  "SalesOrderItemCategory": "example_value",
  "SalesOrderItemText": "example_value",
  "PurchaseOrderByCustomer": "example_value",
  "PricingDate": "example_value",
  "CustomerPaymentTerms": "example_value",
  "MaterialByCustomer": "example_value",
  "Batch": "example_value",
  "ProductionPlant": "example_value",
  "StorageLocation": "example_value",
  "DeliveryPriority": "example_value",
  "IncotermsClassification": "example_value",
  "IncotermsTransferLocation": "example_value",
  "to_PricingElement": [],
  "to_ScheduleLine": [],
  "to_Partner": [],
  "to_Text": []
}